{
  "status": "GREEN",
  "repository": "AILEXSI/ailexsi-core",
  "head": "7c05c91b473d97cfd4f7c6696e4d64e603ce2d46",
  "physics": {
    "core": "0.1.4",
    "graph": "0.2.5"
  },
  "conformance": {
    "suite": "0.1.4",
    "range": "CV-01..CV-44",
    "total": 44,
    "passed": 44,
    "failed": 0,
    "blocked": 0,
    "skipped": 0
  },
  "blockers": [],
  "determinism": "PASS",
  "traceability": "PASS",
  "vectors": [
    {
      "cvId": "CV-01",
      "formulaId": "confidence-1.0.0",
      "formulaVersion": "1.0.0",
      "physicsVersion": "0.1.4",
      "parameterSetId": "PS-002",
      "status": "PASS",
      "actual": {
        "Confidence": 0.32000000000000006
      },
      "expected": {
        "Confidence": 0.32
      },
      "tolerance": 0.000001,
      "failureClass": null
    },
    {
      "cvId": "CV-02",
      "formulaId": "mass-1.0.0",
      "formulaVersion": "1.0.0",
      "physicsVersion": "0.1.4",
      "parameterSetId": "PS-003",
      "status": "PASS",
      "actual": {
        "Mass": 0.37
      },
      "expected": {
        "Mass": 0.37
      },
      "tolerance": 0.000001,
      "failureClass": null
    },
    {
      "cvId": "CV-03",
      "formulaId": "relation-strength-1.0.0",
      "formulaVersion": "1.0.0",
      "physicsVersion": "0.2.5",
      "parameterSetId": "PS-006",
      "status": "PASS",
      "actual": {
        "S_r": 0.6099999999999999
      },
      "expected": {
        "S_r": 0.61
      },
      "tolerance": 0.000001,
      "failureClass": null
    },
    {
      "cvId": "CV-04",
      "formulaId": "retrieval-score-1.0.0",
      "formulaVersion": "1.0.0",
      "physicsVersion": "0.2.5",
      "parameterSetId": "PS-007",
      "status": "PASS",
      "actual": {
        "Score": 0.6040000000000001
      },
      "expected": {
        "Score": 0.604
      },
      "tolerance": 0.000001,
      "failureClass": null
    },
    {
      "cvId": "CV-05",
      "formulaId": "dream-2.0.0",
      "formulaVersion": "2.0.0",
      "physicsVersion": "0.2.5",
      "parameterSetId": "PS-010",
      "status": "PASS",
      "actual": {
        "D": 0.01512,
        "BridgePotential": 0.2
      },
      "expected": {
        "BridgePotential": 0.2,
        "D": 0.01512
      },
      "tolerance": 0.000001,
      "failureClass": null
    },
    {
      "cvId": "CV-06",
      "formulaId": "dream-safety-gate-1.0.0",
      "formulaVersion": "1.0.0",
      "physicsVersion": "0.2.5",
      "parameterSetId": "PS-010",
      "status": "PASS",
      "actual": {
        "status": "PASS",
        "kind": "HYPOTHESIS"
      },
      "expected": {
        "status": "PASS",
        "kind": "HYPOTHESIS"
      },
      "tolerance": 0,
      "failureClass": null
    },
    {
      "cvId": "CV-07",
      "formulaId": "dream-safety-gate-1.0.0",
      "formulaVersion": "1.0.0",
      "physicsVersion": "0.2.5",
      "parameterSetId": "PS-010",
      "status": "PASS",
      "actual": {
        "status": "REJECTED",
        "kind": null
      },
      "expected": {
        "status": "REJECTED",
        "kind": null
      },
      "tolerance": 0,
      "failureClass": null
    },
    {
      "cvId": "CV-08",
      "formulaId": "priority-1.0.0",
      "formulaVersion": "1.0.0",
      "physicsVersion": "0.2.5",
      "parameterSetId": "PS-009",
      "status": "PASS",
      "actual": {
        "Priority": 0.1
      },
      "expected": {
        "Priority": 0.1
      },
      "tolerance": 0.000001,
      "failureClass": null
    },
    {
      "cvId": "CV-09",
      "formulaId": "effective-reliability-1.0.0",
      "formulaVersion": "1.0.0",
      "physicsVersion": "0.1.4",
      "parameterSetId": null,
      "status": "PASS",
      "actual": {
        "EffectiveReliability": 0.7
      },
      "expected": {
        "EffectiveReliability": 0.7
      },
      "tolerance": 0.000001,
      "failureClass": null
    },
    {
      "cvId": "CV-10",
      "formulaId": "semantic-similarity-1.0.0",
      "formulaVersion": "1.0.0",
      "physicsVersion": "0.2.5",
      "parameterSetId": null,
      "status": "PASS",
      "actual": {
        "cosine": 1,
        "S": 1
      },
      "expected": {
        "cosine": 1,
        "S": 1
      },
      "tolerance": 1e-9,
      "failureClass": null
    },
    {
      "cvId": "CV-11",
      "formulaId": "diversity-selection-1.0.0",
      "formulaVersion": "1.0.0",
      "physicsVersion": "0.2.5",
      "parameterSetId": "PS-007",
      "status": "PASS",
      "actual": {
        "selected": [
          "m1",
          "m3"
        ]
      },
      "expected": {
        "selected": [
          "m1",
          "m3"
        ]
      },
      "tolerance": 0,
      "failureClass": null
    },
    {
      "cvId": "CV-12",
      "formulaId": "priority-1.0.0",
      "formulaVersion": "1.0.0",
      "physicsVersion": "0.2.5",
      "parameterSetId": "PS-009",
      "status": "PASS",
      "actual": {
        "Priority": 0
      },
      "expected": {
        "Priority": 0
      },
      "tolerance": 0.000001,
      "failureClass": null
    },
    {
      "cvId": "CV-13",
      "formulaId": null,
      "formulaVersion": null,
      "physicsVersion": "0.2.5",
      "parameterSetId": null,
      "status": "PASS",
      "actual": {
        "status": "conformant"
      },
      "expected": {
        "status": "conformant"
      },
      "tolerance": 0,
      "failureClass": null
    },
    {
      "cvId": "CV-14",
      "formulaId": null,
      "formulaVersion": null,
      "physicsVersion": "0.2.5",
      "parameterSetId": null,
      "status": "PASS",
      "actual": {
        "status": "graph_integrity_violation"
      },
      "expected": {
        "status": "graph_integrity_violation"
      },
      "tolerance": 0,
      "failureClass": null
    },
    {
      "cvId": "CV-15",
      "formulaId": null,
      "formulaVersion": null,
      "physicsVersion": "0.1.4",
      "parameterSetId": null,
      "status": "PASS",
      "actual": {
        "status": "conformant"
      },
      "expected": {
        "status": "conformant"
      },
      "tolerance": 0,
      "failureClass": null
    },
    {
      "cvId": "CV-16",
      "formulaId": "connectivity-potential-1.0.0",
      "formulaVersion": "1.0.0",
      "physicsVersion": "0.2.5",
      "parameterSetId": "PS-005",
      "status": "PASS",
      "actual": {
        "count": 2,
        "ConnectivityPotential": 0.4
      },
      "expected": {
        "count": 2,
        "ConnectivityPotential": 0.4
      },
      "tolerance": 0.000001,
      "failureClass": null
    },
    {
      "cvId": "CV-17",
      "formulaId": "resonance-1.0.0",
      "formulaVersion": "1.0.0",
      "physicsVersion": "0.1.4",
      "parameterSetId": "PS-002",
      "status": "PASS",
      "actual": {
        "R": 0.13120142561521414
      },
      "expected": {
        "R": 0.13120142561521414
      },
      "tolerance": 0.000001,
      "failureClass": null
    },
    {
      "cvId": "CV-18",
      "formulaId": "evidence-strength-1.0.0",
      "formulaVersion": "1.0.0",
      "physicsVersion": "0.1.4",
      "parameterSetId": null,
      "status": "PASS",
      "actual": {
        "E": 0
      },
      "expected": {
        "E": 0
      },
      "tolerance": 0.000001,
      "failureClass": null
    },
    {
      "cvId": "CV-19",
      "formulaId": "source-diversity-1.0.0",
      "formulaVersion": "1.0.0",
      "physicsVersion": "0.1.4",
      "parameterSetId": null,
      "status": "PASS",
      "actual": {
        "SD": 1
      },
      "expected": {
        "SD": 1
      },
      "tolerance": 0.000001,
      "failureClass": null
    },
    {
      "cvId": "CV-20",
      "formulaId": "contradiction-1.0.0",
      "formulaVersion": "1.0.0",
      "physicsVersion": "0.1.4",
      "parameterSetId": null,
      "status": "PASS",
      "actual": {
        "C": 0.5
      },
      "expected": {
        "C": 0.5
      },
      "tolerance": 0.000001,
      "failureClass": null
    },
    {
      "cvId": "CV-21",
      "formulaId": "novelty-1.0.0",
      "formulaVersion": "1.0.0",
      "physicsVersion": "0.1.4",
      "parameterSetId": null,
      "status": "PASS",
      "actual": {
        "N": 1
      },
      "expected": {
        "N": 1
      },
      "tolerance": 0.000001,
      "failureClass": null
    },
    {
      "cvId": "CV-22",
      "formulaId": "usage-1.0.0",
      "formulaVersion": "1.0.0",
      "physicsVersion": "0.1.4",
      "parameterSetId": null,
      "status": "PASS",
      "actual": {
        "U": 0.5
      },
      "expected": {
        "U": 0.5
      },
      "tolerance": 0.000001,
      "failureClass": null
    },
    {
      "cvId": "CV-23",
      "formulaId": "energy-1.0.0",
      "formulaVersion": "1.0.0",
      "physicsVersion": "0.1.4",
      "parameterSetId": "PS-005",
      "status": "PASS",
      "actual": {
        "Energy": 0.04800000000000001
      },
      "expected": {
        "Energy": 0.048
      },
      "tolerance": 0.000001,
      "failureClass": null
    },
    {
      "cvId": "CV-24",
      "formulaId": "gravity-1.0.0",
      "formulaVersion": "1.0.0",
      "physicsVersion": "0.1.4",
      "parameterSetId": null,
      "status": "PASS",
      "actual": {
        "G": 0.06
      },
      "expected": {
        "G": 0.06
      },
      "tolerance": 0.000001,
      "failureClass": null
    },
    {
      "cvId": "CV-25",
      "formulaId": "degree-centrality-1.0.0",
      "formulaVersion": "1.0.0",
      "physicsVersion": "0.2.5",
      "parameterSetId": null,
      "status": "PASS",
      "actual": {
        "D": 0.6666666666666666
      },
      "expected": {
        "D": 0.6666666666666666
      },
      "tolerance": 0.000001,
      "failureClass": null
    },
    {
      "cvId": "CV-26",
      "formulaId": "emergence-1.0.0",
      "formulaVersion": "1.0.0",
      "physicsVersion": "0.2.5",
      "parameterSetId": "PS-011",
      "status": "PASS",
      "actual": {
        "Emergence": 0.04800000000000001
      },